{
  "coverage": {
    "capabilities": [
      "catalog_objects",
      "pg_depend",
      "pg_rewrite_ownership",
      "reverse_dependencies"
    ],
    "catalog_available": true,
    "exhaustive": false,
    "repository_scan": false,
    "unresolved": 1
  },
  "edges": [
    {
      "confidence": "direct",
      "evidence_ids": [
        "ev:45d9b35cafa103957cf2af5e"
      ],
      "explanation": "Source depends on or references target; impact traverses reverse edges. Runtime effects require review.",
      "id": "edge:056208d89c84aa3d6fecdb15",
      "kind": "catalog_dependency",
      "origin": "postgres_catalog",
      "properties": {
        "catalog_address": "pg_class:16396:0->pg_namespace:16388:0",
        "dependency_type": "n",
        "via": "pg_class"
      },
      "source": "postgresql:local/analytics/view//order_summary/",
      "status": "OBSERVED",
      "target": "postgresql:local/analytics/schema//analytics/"
    },
    {
      "confidence": "direct",
      "evidence_ids": [
        "ev:94bf53b50e435deee109a236"
      ],
      "explanation": "Source depends on or references target; impact traverses reverse edges. Runtime effects require review.",
      "id": "edge:0a8c47aa37fc354f4b4568c2",
      "kind": "contains",
      "origin": "postgres_catalog",
      "properties": {},
      "source": "postgresql:local/sales/index//orders_pkey/",
      "status": "OBSERVED",
      "target": "postgresql:local/sales/table//orders/"
    },
    {
      "confidence": "direct",
      "evidence_ids": [
        "ev:0dcbc87e35e0e8b5c14d9e5c"
      ],
      "explanation": "Source depends on or references target; impact traverses reverse edges. Runtime effects require review.",
      "id": "edge:1e22031734eb8d95d585eab9",
      "kind": "catalog_dependency",
      "origin": "postgres_catalog",
      "properties": {
        "catalog_address": "pg_class:16400:0->pg_namespace:16388:0",
        "dependency_type": "n",
        "via": "pg_class"
      },
      "source": "postgresql:local/analytics/view//monthly_revenue/",
      "status": "OBSERVED",
      "target": "postgresql:local/analytics/schema//analytics/"
    },
    {
      "confidence": "direct",
      "evidence_ids": [
        "ev:10a5cef22313ed07c5c01130"
      ],
      "explanation": "Source depends on or references target; impact traverses reverse edges. Runtime effects require review.",
      "id": "edge:33adc274c68e8a9db5269838",
      "kind": "expression_reference",
      "origin": "postgres_catalog",
      "properties": {},
      "source": "postgresql:local/sales/constraint/orders/orders_total_amount_not_null/",
      "status": "OBSERVED",
      "target": "postgresql:local/sales/column/orders/total_amount/"
    },
    {
      "confidence": "direct",
      "evidence_ids": [
        "ev:0945ec2f971483bce560c4b2"
      ],
      "explanation": "Source depends on or references target; impact traverses reverse edges. Runtime effects require review.",
      "id": "edge:46be06185d2d854f7d861dc5",
      "kind": "catalog_dependency",
      "origin": "postgres_catalog",
      "properties": {
        "catalog_address": "pg_type:16390:0->pg_type:16391:0",
        "dependency_type": "i",
        "via": "pg_type"
      },
      "source": "postgresql:local/sales/type//_orders/",
      "status": "OBSERVED",
      "target": "postgresql:local/sales/type//orders/"
    },
    {
      "confidence": "direct",
      "evidence_ids": [
        "ev:10a5cef22313ed07c5c01130"
      ],
      "explanation": "Source depends on or references target; impact traverses reverse edges. Runtime effects require review.",
      "id": "edge:46eea5bd97bf831a975c7342",
      "kind": "contains",
      "origin": "postgres_catalog",
      "properties": {},
      "source": "postgresql:local/sales/constraint/orders/orders_id_not_null/",
      "status": "OBSERVED",
      "target": "postgresql:local/sales/table//orders/"
    },
    {
      "confidence": "direct",
      "evidence_ids": [
        "ev:e073c156d4870e6df674b8d8"
      ],
      "explanation": "Source depends on or references target; impact traverses reverse edges. Runtime effects require review.",
      "id": "edge:48b0c940d4da7c979141a6b6",
      "kind": "catalog_dependency",
      "origin": "postgres_catalog",
      "properties": {
        "catalog_address": "pg_constraint:16395:0->pg_class:16389:1",
        "dependency_type": "a",
        "via": "pg_constraint"
      },
      "source": "postgresql:local/sales/constraint/orders/orders_pkey/",
      "status": "OBSERVED",
      "target": "postgresql:local/sales/column/orders/id/"
    },
    {
      "confidence": "direct",
      "evidence_ids": [
        "ev:a18cd7ab749ffd45da973e4f"
      ],
      "explanation": "Source depends on or references target; impact traverses reverse edges. Runtime effects require review.",
      "id": "edge:4d95cd8f47074ab437ac62a5",
      "kind": "catalog_dependency",
      "origin": "postgres_catalog",
      "properties": {
        "catalog_address": "pg_type:16397:0->pg_type:16398:0",
        "dependency_type": "i",
        "via": "pg_type"
      },
      "source": "postgresql:local/analytics/type//_order_summary/",
      "status": "OBSERVED",
      "target": "postgresql:local/analytics/type//order_summary/"
    },
    {
      "confidence": "direct",
      "evidence_ids": [
        "ev:4e94d8a44687244d3018b756"
      ],
      "explanation": "Source depends on or references target; impact traverses reverse edges. Runtime effects require review.",
      "id": "edge:5478cb147e8a08cfcc0208bf",
      "kind": "catalog_dependency",
      "origin": "postgres_catalog",
      "properties": {
        "catalog_address": "pg_rewrite:16403:0->pg_class:16396:2",
        "dependency_type": "n",
        "via": "pg_rewrite"
      },
      "source": "postgresql:local/analytics/view//monthly_revenue/",
      "status": "OBSERVED",
      "target": "postgresql:local/analytics/column/order_summary/total_amount/"
    },
    {
      "confidence": "direct",
      "evidence_ids": [
        "ev:97b8b53b0789c823f69fe6a5"
      ],
      "explanation": "Source depends on or references target; impact traverses reverse edges. Runtime effects require review.",
      "id": "edge:55cc31eaf22b798c2164ec54",
      "kind": "catalog_dependency",
      "origin": "postgres_catalog",
      "properties": {
        "catalog_address": "pg_type:16401:0->pg_type:16402:0",
        "dependency_type": "i",
        "via": "pg_type"
      },
      "source": "postgresql:local/analytics/type//_monthly_revenue/",
      "status": "OBSERVED",
      "target": "postgresql:local/analytics/type//monthly_revenue/"
    },
    {
      "confidence": "direct",
      "evidence_ids": [
        "ev:94bf53b50e435deee109a236"
      ],
      "explanation": "Source depends on or references target; impact traverses reverse edges. Runtime effects require review.",
      "id": "edge:585b66573bc42ab100b3a1dc",
      "kind": "expression_reference",
      "origin": "postgres_catalog",
      "properties": {},
      "source": "postgresql:local/sales/index//orders_pkey/",
      "status": "OBSERVED",
      "target": "postgresql:local/sales/column/orders/id/"
    },
    {
      "confidence": "direct",
      "evidence_ids": [
        "ev:ae9518b47e51bd76d8120289"
      ],
      "explanation": "Source depends on or references target; impact traverses reverse edges. Runtime effects require review.",
      "id": "edge:5888b841d8ac8406dc4efa32",
      "kind": "catalog_dependency",
      "origin": "postgres_catalog",
      "properties": {
        "catalog_address": "pg_rewrite:16399:0->pg_class:16389:1",
        "dependency_type": "n",
        "via": "pg_rewrite"
      },
      "source": "postgresql:local/analytics/view//order_summary/",
      "status": "OBSERVED",
      "target": "postgresql:local/sales/column/orders/id/"
    },
    {
      "confidence": "direct",
      "evidence_ids": [
        "ev:10a5cef22313ed07c5c01130"
      ],
      "explanation": "Source depends on or references target; impact traverses reverse edges. Runtime effects require review.",
      "id": "edge:6de9a81ca0690cfadea55519",
      "kind": "expression_reference",
      "origin": "postgres_catalog",
      "properties": {},
      "source": "postgresql:local/sales/constraint/orders/orders_pkey/",
      "status": "OBSERVED",
      "target": "postgresql:local/sales/column/orders/id/"
    },
    {
      "confidence": "direct",
      "evidence_ids": [
        "ev:90a64f3016d97b0343f1bd48"
      ],
      "explanation": "Source depends on or references target; impact traverses reverse edges. Runtime effects require review.",
      "id": "edge:7382463a30822eedad6c5a9a",
      "kind": "catalog_dependency",
      "origin": "postgres_catalog",
      "properties": {
        "catalog_address": "pg_rewrite:16399:0->pg_class:16389:2",
        "dependency_type": "n",
        "via": "pg_rewrite"
      },
      "source": "postgresql:local/analytics/view//order_summary/",
      "status": "OBSERVED",
      "target": "postgresql:local/sales/column/orders/total_amount/"
    },
    {
      "confidence": "direct",
      "evidence_ids": [
        "ev:d680e8bdddcc4d7014effc22"
      ],
      "explanation": "Source depends on or references target; impact traverses reverse edges. Runtime effects require review.",
      "id": "edge:7dbacce2ca01cccde5c50180",
      "kind": "catalog_dependency",
      "origin": "postgres_catalog",
      "properties": {
        "catalog_address": "pg_class:16389:0->pg_namespace:16387:0",
        "dependency_type": "n",
        "via": "pg_class"
      },
      "source": "postgresql:local/sales/table//orders/",
      "status": "OBSERVED",
      "target": "postgresql:local/sales/schema//sales/"
    },
    {
      "confidence": "direct",
      "evidence_ids": [
        "ev:e1b7cfaf007c8cada9f1ae20"
      ],
      "explanation": "Source depends on or references target; impact traverses reverse edges. Runtime effects require review.",
      "id": "edge:7f81923f375e97d964167b72",